{
  "$schema": "../schemas/workload-profile.schema.json",
  "schema_version": "1.1.0",
  "profile_id": "cell-10k-v1",
  "revision": 1,
  "status": "target",
  "evidence_level": "target",
  "description": "A one-tenth calibration slice of MIX-100K-v1 for one iveKit Cell: 10,000 pairwise-disjoint active interactions with the same channel, media, recording, intelligence, reconnect, and failure ratios. Passing this profile does not by multiplication prove MIX-100K platform capacity.",
  "interactions": {
    "total": 10000,
    "id_uniqueness": "globally_unique_and_cross_category_disjoint",
    "categories": [
      {
        "id": "tinode_im",
        "kind": "tinode_im",
        "count": 6000,
        "active_definition": "An active customer-service topic producing business messages during the steady window; 6,000 customers are served by 2,000 agents or bots averaging three simultaneous topics.",
        "disjoint_from": ["sip_voice", "livekit_av", "livekit_screen", "rustdesk_remote"],
        "participants": 12000,
        "logical_identities": 8000
      },
      {
        "id": "sip_voice",
        "kind": "sip_voice",
        "count": 2500,
        "active_definition": "A connected two-party logical SIP call with two base RTP legs.",
        "disjoint_from": ["tinode_im", "livekit_av", "livekit_screen", "rustdesk_remote"],
        "participants": 5000
      },
      {
        "id": "livekit_av",
        "kind": "livekit_av",
        "count": 1000,
        "active_definition": "A distinct LiveKit one-to-one room with two connected participants publishing audio and camera video.",
        "disjoint_from": ["tinode_im", "sip_voice", "livekit_screen", "rustdesk_remote"],
        "participants": 2000
      },
      {
        "id": "livekit_screen",
        "kind": "livekit_screen",
        "count": 300,
        "active_definition": "A distinct LiveKit collaboration room with one screen publisher and one subscriber; its interaction ID is not one of the 1,000 A/V room IDs.",
        "disjoint_from": ["tinode_im", "sip_voice", "livekit_av", "rustdesk_remote"],
        "participants": 600
      },
      {
        "id": "rustdesk_remote",
        "kind": "rustdesk_remote",
        "count": 200,
        "active_definition": "An authorized RustDesk remote-assistance session with two connected endpoints and active screen updates.",
        "disjoint_from": ["tinode_im", "sip_voice", "livekit_av", "livekit_screen"],
        "participants": 400
      }
    ]
  },
  "connections": [
    {
      "id": "tinode_websocket",
      "kind": "tinode_websocket",
      "count": 9000,
      "idle_only_forbidden": true,
      "activity_contract": "8,000 logical identities with an average of 1.125 connected devices; active topics, receipts, presence, typing, and reconnect behavior are enabled."
    },
    {
      "id": "ivekit_event_websocket",
      "kind": "ivekit_event_websocket",
      "count": 5000,
      "idle_only_forbidden": true,
      "activity_contract": "Connections receive interaction, audit, notification, and state events at the profile event rate."
    },
    {
      "id": "sip_registration",
      "kind": "sip_registration",
      "count": 2500,
      "idle_only_forbidden": true,
      "activity_contract": "Registered contacts refresh normally and participate in call setup and failure recovery."
    },
    {
      "id": "sip_websocket",
      "kind": "sip_websocket",
      "count": 1000,
      "idle_only_forbidden": true,
      "activity_contract": "SIP over WSS contacts are a measured subset of registered contacts."
    },
    {
      "id": "livekit_participant",
      "kind": "livekit_participant",
      "count": 2600,
      "idle_only_forbidden": true,
      "activity_contract": "All participants publish or subscribe to the media required by their interaction category."
    },
    {
      "id": "rustdesk_endpoint",
      "kind": "rustdesk_endpoint",
      "count": 400,
      "idle_only_forbidden": true,
      "activity_contract": "Each endpoint is attached to one authorized remote session and emits native session/audit evidence."
    }
  ],
  "signaling": {
    "sip": {
      "active_calls": 2500,
      "base_rtp_legs": 5000,
      "average_call_duration_seconds": 180,
      "steady_invite_cps": 14,
      "burst_invite_cps": 100,
      "burst_duration_seconds": 60,
      "registered_contacts": 2500,
      "sip_over_wss_contacts": 1000,
      "tls_ratio": 0.4,
      "srtp_ratio": 0.4
    }
  },
  "messaging": {
    "business_messages_per_second": 500,
    "burst_messages_per_second": 2000,
    "burst_duration_seconds": 60,
    "activity_mix": {
      "one_to_one_ratio": 0.95,
      "group_ratio": 0.05
    },
    "receipts_enabled": true,
    "presence_enabled": true,
    "typing_enabled": true,
    "attachment_message_ratio": 0.1,
    "attachment_payload": {
      "average_bytes": 524288,
      "p95_bytes": 5242880,
      "maximum_bytes": 26214400
    },
    "hot_topic": {
      "subscriber_count": 1000,
      "messages_per_second": 10
    }
  },
  "media": {
    "voice": {
      "codec": "PCMU",
      "packetization_ms": 20,
      "payload_kbps": 64,
      "rtp_header_bytes": 40,
      "base_calls": 2500,
      "base_rtp_legs": 5000,
      "supervisor_or_consult_ratio": 0.1
    },
    "livekit": {
      "av": {
        "rooms": 1000,
        "participants": 2000,
        "audio_codec": "OPUS",
        "audio_kbps_per_publisher": 32,
        "video_resolution": "720p",
        "video_fps": 30,
        "video_average_kbps_per_publisher": 1500,
        "simulcast": true
      },
      "screen": {
        "rooms": 300,
        "participants": 600,
        "publishers_per_room": 1,
        "subscribers_per_room": 1,
        "resolution": "1080p",
        "fps": 15,
        "average_kbps_per_publisher": 2000,
        "peak_kbps_per_publisher": 4000,
        "camera_video_enabled": false
      },
      "turn_participant_ratio": 0.2,
      "forced_turn_profile_required": true,
      "overlay_test": {
        "enabled": true,
        "av_rooms_with_added_screen_ratio": 0.3,
        "counts_toward_interaction_total": false
      }
    },
    "rustdesk": {
      "sessions": 200,
      "endpoints": 400,
      "relay_ratio": 0.4,
      "office_average_kbps_per_relay": 800,
      "high_motion_peak_kbps_per_relay": 24000,
      "forced_relay_profile_required": true
    }
  },
  "recording": {
    "voice": {
      "interaction_ratio": 0.5,
      "mode": "encoded_fork",
      "hot_path": "local_spool_then_upload",
      "counts_as_core_admission": true,
      "selection_scope": "sip_voice_interactions",
      "selected_artifact": "dual_leg_encoded_voice_recording"
    },
    "livekit_track": {
      "interaction_ratio": 0.2,
      "mode": "track_egress",
      "hot_path": "separate_egress_pool",
      "counts_as_core_admission": true,
      "selection_scope": "livekit_av_interactions",
      "selected_artifact": "all_published_audio_camera_tracks"
    },
    "livekit_room_composite": {
      "interaction_ratio": 0.01,
      "mode": "room_composite",
      "hot_path": "separate_egress_pool",
      "counts_as_core_admission": false,
      "selection_scope": "livekit_av_interactions",
      "selected_artifact": "room_composite_output",
      "output_average_kbps": 2500
    },
    "screen_track": {
      "interaction_ratio": 0.2,
      "mode": "track_egress",
      "hot_path": "separate_egress_pool",
      "counts_as_core_admission": true,
      "selection_scope": "livekit_screen_interactions",
      "selected_artifact": "published_screen_track"
    },
    "rustdesk": {
      "interaction_ratio": 0.1,
      "mode": "local_edge_upload",
      "hot_path": "local_spool_then_upload",
      "counts_as_core_admission": false,
      "selection_scope": "rustdesk_remote_interactions",
      "selected_artifact": "rustdesk_local_recording"
    }
  },
  "intelligence": {
    "realtime_voice_asr_ratio": 0.2,
    "post_call_asr_ratio": 0.8,
    "ocr_attachment_ratio": 1,
    "translation_message_ratio": 0.2,
    "ai_quality_interaction_ratio": 1,
    "backpressure_policy": "durable_queue_and_never_block_realtime_ack"
  },
  "durations": {
    "ramp_minutes": 60,
    "steady_minutes": 120,
    "burst_seconds": 60,
    "endurance_hours": 24,
    "endurance_load_ratio": 0.7
  },
  "failure_model": {
    "node_failure_repetitions": 3,
    "zone_failure_repetitions": 3,
    "reconnect_client_ratio": 0.2,
    "reconnect_window_seconds": 60,
    "quorum_failures": [
      "postgresql_leader",
      "redis_primary",
      "nats_leader",
      "network_partition"
    ]
  },
  "slos": {
    "sip_setup_success_ratio": 0.9999,
    "sip_route_p99_ms": 150,
    "rtp_server_packet_loss_ratio": 0.001,
    "im_ack_p99_ms": 500,
    "durable_loss_count": 0,
    "livekit_join_p99_ms": 5000,
    "new_admission_recovery_seconds": 30,
    "four_node_linearity_ratio": 0.93,
    "eight_node_linearity_ratio": 0.91
  },
  "external_dependencies": [
    { "id": "pstn_sip_trunk", "status": "not_run", "required_for_production_pass": true },
    { "id": "public_network", "status": "not_run", "required_for_production_pass": true },
    { "id": "real_turn", "status": "not_run", "required_for_production_pass": true },
    { "id": "livekit_egress", "status": "controlled", "required_for_production_pass": true },
    { "id": "object_storage", "status": "not_run", "required_for_production_pass": true },
    { "id": "ocr_provider", "status": "not_run", "required_for_production_pass": true },
    { "id": "asr_provider", "status": "not_run", "required_for_production_pass": true },
    { "id": "translation_provider", "status": "not_run", "required_for_production_pass": true },
    { "id": "ai_provider", "status": "not_run", "required_for_production_pass": true },
    { "id": "windows_endpoints", "status": "not_run", "required_for_production_pass": true }
  ]
}
